{
  "schemaVersion": "vehicle-subclass-t9-execution-v1",
  "sourcePoolSha256": "ffffffffffffffffffffffffffffffffffffffffffffffffffffffffffffffff",
  "sourcePoolBinding": {
    "gitCommit": "1111111111111111111111111111111111111111",
    "gitPath": "docs/qualification/stage3/s3-2-source-pool.json"
  },
  "ingestionMapSha256": "9999999999999999999999999999999999999999999999999999999999999999",
  "ingestionMapBinding": {
    "gitCommit": "2222222222222222222222222222222222222222",
    "gitPath": "docs/qualification/stage3/s3-2-ingestion-map.json"
  },
  "releaseRecordSha256": "7777777777777777777777777777777777777777777777777777777777777777",
  "measuredProfileSha256": "afb03b6c4da61fbf6021ef855307f80c5b7206996e7e21c8d297394b091a18bf",
  "producer": {
    "modelId": "rtmdet-m",
    "modelVersion": "1",
    "pipelineProfileId": "phase1-detection-tracking-v1",
    "pipelineProfileVersion": "1.3.0-candidate",
    "runtimeProfileId": "runtime-v1",
    "runtimeVariant": "linux-x86_64-cpu",
    "verificationStatus": "unverified",
    "maviCommit": "aaaaaaaaaaaaaaaaaaaaaaaaaaaaaaaaaaaaaaaa",
    "modelManifestSha256": "1111111111111111111111111111111111111111111111111111111111111111",
    "checkpointSha256": "2222222222222222222222222222222222222222222222222222222222222222",
    "resolvedConfigSha256": "3333333333333333333333333333333333333333333333333333333333333333",
    "pipelineProfileSha256": "afb03b6c4da61fbf6021ef855307f80c5b7206996e7e21c8d297394b091a18bf",
    "runtimeProfileSha256": "5555555555555555555555555555555555555555555555555555555555555555",
    "qualificationSha256": null,
    "componentBindingSha256": "9999999999999999999999999999999999999999999999999999999999999999",
    "maviBuild": "build-attestation",
    "modelPackId": "mavi-model-v2-7777777777777777777777777777777777777777777777777777777777777777",
    "runtimePackId": "mavi-runtime-v2-8888888888888888888888888888888888888888888888888888888888888888",
    "runtimePackSource": "installed-pack",
    "platform": {
      "machine": "x86_64",
      "processor": "x86_64",
      "pythonBuild": [
        "main",
        "Sep 2026"
      ],
      "pythonCompiler": "GCC",
      "pythonImplementation": "CPython",
      "pythonVersion": "3.12.14",
      "release": "6.8",
      "system": "Linux",
      "version": "qualified"
    }
  },
  "cameras": [
    {
      "sourceCamera": "c001",
      "cameraCode": "S32-C001",
      "name": "Synthetic camera c001",
      "timeZoneId": "America/New_York",
      "cameraId": "01a0ffb2-c000-7000-8000-000000000001"
    },
    {
      "sourceCamera": "c002",
      "cameraCode": "S32-C002",
      "name": "Synthetic camera c002",
      "timeZoneId": "America/New_York",
      "cameraId": "01a0ffb2-c000-7000-8000-000000000002"
    },
    {
      "sourceCamera": "c003",
      "cameraCode": "S32-C003",
      "name": "Synthetic camera c003",
      "timeZoneId": "America/New_York",
      "cameraId": "01a0ffb2-c000-7000-8000-000000000003"
    }
  ],
  "members": [
    {
      "member": "videos/c001/clip-00.mkv",
      "cameraCode": "S32-C001",
      "recordingStartLocal": "2026-04-01T09:00:00",
      "recordingTime": {
        "source": "development-convention",
        "convention": {
          "sha256": "dddddddddddddddddddddddddddddddddddddddddddddddddddddddddddddddd",
          "gitCommit": "eeeeeeeeeeeeeeeeeeeeeeeeeeeeeeeeeeeeeeee",
          "gitPath": "docs/qualification/stage3/s3-2-ingestion-convention.md"
        }
      },
      "derivationManifestSha256": "00000000000000000000000000000000000000000000000000000000000000c8",
      "derivedSha256": "000000000000000000000000000000000000000000000000000000000000012c",
      "videoAssetId": "01a0ffb2-c9b2-73ea-8fcd-115230000000",
      "processingRunId": "01a0ffb2-cb2e-77c1-9f44-256be4fcc300",
      "attestationSha256": "0000000000000000000000000000000000000000000000000000000000000190",
      "exportSha256": "00000000000000000000000000000000000000000000000000000000000001f4"
    },
    {
      "member": "videos/c002/clip-01.mkv",
      "cameraCode": "S32-C002",
      "recordingStartLocal": "2026-04-02T09:00:00",
      "recordingTime": {
        "source": "release-metadata",
        "evidence": {
          "releaseRecordSha256": "7777777777777777777777777777777777777777777777777777777777777777",
          "member": "metadata/timestamps.txt"
        }
      },
      "derivationManifestSha256": "00000000000000000000000000000000000000000000000000000000000000c9",
      "derivedSha256": "000000000000000000000000000000000000000000000000000000000000012d",
      "videoAssetId": "01a0ffb2-c9b2-73ea-8fcd-115230000001",
      "processingRunId": "01a0ffb2-cb2e-77c1-9f44-256be4fcc301",
      "attestationSha256": "0000000000000000000000000000000000000000000000000000000000000191",
      "exportSha256": "00000000000000000000000000000000000000000000000000000000000001f5"
    },
    {
      "member": "videos/c003/clip-02.mkv",
      "cameraCode": "S32-C003",
      "recordingStartLocal": "2026-04-03T09:00:00",
      "recordingTime": {
        "source": "development-convention",
        "convention": {
          "sha256": "dddddddddddddddddddddddddddddddddddddddddddddddddddddddddddddddd",
          "gitCommit": "eeeeeeeeeeeeeeeeeeeeeeeeeeeeeeeeeeeeeeee",
          "gitPath": "docs/qualification/stage3/s3-2-ingestion-convention.md"
        }
      },
      "derivationManifestSha256": "00000000000000000000000000000000000000000000000000000000000000ca",
      "derivedSha256": "000000000000000000000000000000000000000000000000000000000000012e",
      "videoAssetId": "01a0ffb2-c9b2-73ea-8fcd-115230000002",
      "processingRunId": "01a0ffb2-cb2e-77c1-9f44-256be4fcc302",
      "attestationSha256": "0000000000000000000000000000000000000000000000000000000000000192",
      "exportSha256": "00000000000000000000000000000000000000000000000000000000000001f6"
    },
    {
      "member": "videos/c001/clip-03.mkv",
      "cameraCode": "S32-C001",
      "recordingStartLocal": "2026-04-04T09:00:00",
      "recordingTime": {
        "source": "release-metadata",
        "evidence": {
          "releaseRecordSha256": "7777777777777777777777777777777777777777777777777777777777777777",
          "member": "metadata/timestamps.txt"
        }
      },
      "derivationManifestSha256": "00000000000000000000000000000000000000000000000000000000000000cb",
      "derivedSha256": "000000000000000000000000000000000000000000000000000000000000012f",
      "videoAssetId": "01a0ffb2-c9b2-73ea-8fcd-115230000003",
      "processingRunId": "01a0ffb2-cb2e-77c1-9f44-256be4fcc303",
      "attestationSha256": "0000000000000000000000000000000000000000000000000000000000000193",
      "exportSha256": "00000000000000000000000000000000000000000000000000000000000001f7"
    },
    {
      "member": "videos/c002/clip-04.mkv",
      "cameraCode": "S32-C002",
      "recordingStartLocal": "2026-04-05T09:00:00",
      "recordingTime": {
        "source": "development-convention",
        "convention": {
          "sha256": "dddddddddddddddddddddddddddddddddddddddddddddddddddddddddddddddd",
          "gitCommit": "eeeeeeeeeeeeeeeeeeeeeeeeeeeeeeeeeeeeeeee",
          "gitPath": "docs/qualification/stage3/s3-2-ingestion-convention.md"
        }
      },
      "derivationManifestSha256": "00000000000000000000000000000000000000000000000000000000000000cc",
      "derivedSha256": "0000000000000000000000000000000000000000000000000000000000000130",
      "videoAssetId": "01a0ffb2-c9b2-73ea-8fcd-115230000004",
      "processingRunId": "01a0ffb2-cb2e-77c1-9f44-256be4fcc304",
      "attestationSha256": "0000000000000000000000000000000000000000000000000000000000000194",
      "exportSha256": "00000000000000000000000000000000000000000000000000000000000001f8"
    },
    {
      "member": "videos/c003/clip-05.mkv",
      "cameraCode": "S32-C003",
      "recordingStartLocal": "2026-04-06T09:00:00",
      "recordingTime": {
        "source": "release-metadata",
        "evidence": {
          "releaseRecordSha256": "7777777777777777777777777777777777777777777777777777777777777777",
          "member": "metadata/timestamps.txt"
        }
      },
      "derivationManifestSha256": "00000000000000000000000000000000000000000000000000000000000000cd",
      "derivedSha256": "0000000000000000000000000000000000000000000000000000000000000131",
      "videoAssetId": "01a0ffb2-c9b2-73ea-8fcd-115230000005",
      "processingRunId": "01a0ffb2-cb2e-77c1-9f44-256be4fcc305",
      "attestationSha256": "0000000000000000000000000000000000000000000000000000000000000195",
      "exportSha256": "00000000000000000000000000000000000000000000000000000000000001f9"
    }
  ]
}
